{"contractVersion":"1.0.0","correlationId":"00000000-0000-4000-8000-000000000001","causationId":"00000000-0000-4000-8000-000000000301","jobId":"00000000-0000-4000-8000-000000000301","attemptId":"00000000-0000-4000-8000-000000000401","messageType":"WORKER_RESULT","sequence":1,"startedAt":"2026-07-15T00:00:00.000Z","finishedAt":"2026-07-15T00:00:02.000Z","outcome":"CANCELLED","providerDescriptor":{"providerId":"reference.document","providerVersion":"1.0.0","adapterVersion":"1.0.0","contractVersions":["1.0.0"],"operations":["DOCUMENT_CONVERSION"],"inputMediaTypes":["application/pdf"],"outputMediaTypes":["text/markdown"],"capabilities":["CANCELLATION"],"offlineCapable":true,"deterministicClaim":"DETERMINISTIC","requiresNetwork":false,"binaryDigest":null,"modelDigests":[],"generatedAt":"2026-07-15T00:00:00.000Z"},"warnings":[],"metrics":{"wallTimeMs":2000,"peakMemoryBytes":1000000,"bytesRead":1024,"bytesWritten":0},"result":null,"error":{"code":"CANCELLED_BY_CONTROL_PLANE","category":"CANCELLED","retryable":false,"message":"The attempt was cancelled."}}
